{
  "eventId": "11111111-1111-4111-8111-111111111113",
  "eventType": "order.cancelled",
  "tenantId": "default-tenant",
  "orderId": "22222222-2222-4222-8222-222222222224",
  "userId": "33333333-3333-4333-8333-333333333333",
  "symbol": "MSFT",
  "side": "BUY",
  "orderType": "LIMIT",
  "quantity": 25,
  "status": "cancelled",
  "occurredAt": "2026-06-08T10:02:00Z",
  "correlationId": "demo-surveillance-cancelled"
}
